### ISSUE TITLE
memo

### ISSUE THREAD

**Issue by AkihiroSuda** [AkihiroSuda/demo-funker-issue#1]

**Comment by AkihiroSuda** [comment]
setting userland-proxy to false does not seem have an effect

**Comment by AkihiroSuda** [comment]
memo

```console
$ docker network ls | grep demo-nw
wj6r3g3dfs7c        demo-nw             overlay             swarm
$ ln -s /var/run/docker/netns /var/run/netns
```

0s (works)
```
$ ip netns exec 1-wj6r3g3dfs tcpdump -l -X -s 0
tcpdump: verbose output suppressed, use -v or -vv for full protocol decode
listening on br0, link-type EN10MB (Ethernet), capture size 262144 bytes
17:43:59.924694 IP 10.0.0.4.52138 > 10.0.0.3.9999: Flags [S], seq 563275846, win 28200, options [mss 1410,sackOK,TS val 70588015 ecr 0,nop,wscale 7], length 0
        0x0000:  4500 003c fe29 4000 4006 288c 0a00 0004  E..<.)@.@.(.....
        0x0010:  0a00 0003 cbaa 270f 2192 e846 0000 0000  ......'.!..F....
        0x0020:  a002 6e28 1435 0000 0204 0582 0402 080a  ..n(.5..........
        0x0030:  0435 166f 0000 0000 0103 0307            .5.o........
17:43:59.924724 IP 10.0.0.3.9999 > 10.0.0.4.52138: Flags [S.], seq 2665369411, ack 563275847, win 27960, options [mss 1410,sackOK,TS val 70588015 ecr 70588015,nop,wscale 7], length 0
        0x0000:  4500 003c 0000 4000 4006 26b6 0a00 0003  E..<..@.@.&.....
        0x0010:  0a00 0004 270f cbaa 9ede 4f43 2192 e847  ....'.....OC!..G
        0x0020:  a012 6d38 1435 0000 0204 0582 0402 080a  ..m8.5..........
        0x0030:  0435 166f 0435 166f 0103 0307            .5.o.5.o....
17:43:59.924739 IP 10.0.0.4.52138 > 10.0.0.3.9999: Flags [.], ack 1, win 221, options [nop,nop,TS val 70588015 ecr 70588015], length 0
        0x0000:  4500 0034 fe2a 4000 4006 2893 0a00 0004  E..4.*@.@.(.....
        0x0010:  0a00 0003 cbaa 270f 2192 e847 9ede 4f44  ......'.!..G..OD
        0x0020:  8010 00dd 142d 0000 0101 080a 0435 166f  .....-.......5.o
        0x0030:  0435 166f                                .5.o
17:43:59.924778 IP 10.0.0.4.52138 > 10.0.0.3.9999: Flags [P.], seq 1:54, ack 1, win 221, options [nop,nop,TS val 70588015 ecr 70588015], length 53
        0x0000:  4500 0069 fe2b 4000 4006 285d 0a00 0004  E..i.+@.@.(]....
        0x0010:  0a00 0003 cbaa 270f 2192 e847 9ede 4f44  ......'.!..G..OD
        0x0020:  8018 00dd 1462 0000 0101 080a 0435 166f  .....b.......5.o
        0x0030:  0435 166f 7b22 7822 3a22 6865 6c6c 6f22  .5.o{"x":"hello"
        0x0040:  2c22 7469 6d65 223a 2232 3031 362d 3132  ,"time":"2016-12
        0x0050:  2d32 3254 3038 3a34 333a 3539 2e38 3738  -22T08:43:59.878
        0x0060:  3739 3938 3334 5a22 7d                   799834Z"}
17:43:59.924785 IP 10.0.0.3.9999 > 10.0.0.4.52138: Flags [.], ack 54, win 219, options [nop,nop,TS val 70588015 ecr 70588015], length 0
        0x0000:  4500 0034 592b 4000 4006 cd92 0a00 0003  E..4Y+@.@.......
        0x0010:  0a00 0004 270f cbaa 9ede 4f44 2192 e87c  ....'.....OD!..|
        0x0020:  8010 00db 142d 0000 0101 080a 0435 166f  .....-.......5.o
        0x0030:  0435 166f                                .5.o
17:43:59.924796 IP 10.0.0.4.52138 > 10.0.0.3.9999: Flags [F.], seq 54, ack 1, win 221, options [nop,nop,TS val 70588015 ecr 70588015], length 0
        0x0000:  4500 0034 fe2c 4000 4006 2891 0a00 0004  E..4.,@.@.(.....
        0x0010:  0a00 0003 cbaa 270f 2192 e87c 9ede 4f44  ......'.!..|..OD
        0x0020:  8011 00dd 142d 0000 0101 080a 0435 166f  .....-.......5.o
        0x0030:  0435 166f                                .5.o
17:43:59.924922 IP 10.0.0.3.9999 > 10.0.0.4.52138: Flags [P.], seq 1:54, ack 55, win 219, options [nop,nop,TS val 70588015 ecr 70588015], length 53
        0x0000:  4500 0069 592c 4000 4006 cd5c 0a00 0003  E..iY,@.@..\....
        0x0010:  0a00 0004 270f cbaa 9ede 4f44 2192 e87d  ....'.....OD!..}
        0x0020:  8018 00db 1462 0000 0101 080a 0435 166f  .....b.......5.o
        0x0030:  0435 166f 7b22 7822 3a22 6865 6c6c 6f22  .5.o{"x":"hello"
        0x0040:  2c22 7469 6d65 223a 2232 3031 362d 3132  ,"time":"2016-12
        0x0050:  2d32 3254 3038 3a34 333a 3539 2e39 3234  -22T08:43:59.924
        0x0060:  3839 3731 3737 5a22 7d                   897177Z"}
17:44:05.112364 ARP, Request who-has 10.0.0.4 tell 10.0.0.3, length 28
        0x0000:  0001 0800 0604 0001 0242 0a00 0003 0a00  .........B......
        0x0010:  0003 0000 0000 0000 0a00 0004            ............
17:44:05.112376 ARP, Request who-has 10.0.0.3 tell 10.0.0.4, length 28
        0x0000:  0001 0800 0604 0001 0242 0a00 0004 0a00  .........B......
        0x0010:  0004 0000 0000 0000 0a00 0003            ............
17:44:05.112434 ARP, Reply 10.0.0.4 is-at 02:42:0a:00:00:04 (oui Unknown), length 28
        0x0000:  0001 0800 0604 0002 0242 0a00 0004 0a00  .........B......
        0x0010:  0004 0242 0a00 0003 0a00 0003            ...B........
17:44:05.112437 ARP, Reply 10.0.0.3 is-at 02:42:0a:00:00:03 (oui Unknown), length 28
        0x0000:  0001 0800 0604 0002 0242 0a00 0003 0a00  .........B......
        0x0010:  0003 0242 0a00 0004 0a00 0004            ...B........
^C
```

5s (works)
```
$ ip netns exec 1-wj6r3g3dfs tcpdump -l -X -s 0
tcpdump: verbose output suppressed, use -v or -vv for full protocol decode
listening on br0, link-type EN10MB (Ethernet), capture size 262144 bytes
17:45:24.020121 IP 10.0.0.4.53560 > 10.0.0.3.9999: Flags [S], seq 2411297634, win 28200, options [mss 1410,sackOK,TS val 70609038 ecr 0,nop,wscale 7], length 0
        0x0000:  4500 003c 13ec 4000 4006 12ca 0a00 0004  E..<..@.@.......
        0x0010:  0a00 0003 d138 270f 8fb9 7b62 0000 0000  .....8'...{b....
        0x0020:  a002 6e28 1435 0000 0204 0582 0402 080a  ..n(.5..........
        0x0030:  0435 688e 0000 0000 0103 0307            .5h.........
17:45:24.020151 IP 10.0.0.3.9999 > 10.0.0.4.53560: Flags [S.], seq 3265327178, ack 2411297635, win 27960, options [mss 1410,sackOK,TS val 70609038 ecr 70609038,nop,wscale 7], length 0
        0x0000:  4500 003c 0000 4000 4006 26b6 0a00 0003  E..<..@.@.&.....
        0x0010:  0a00 0004 270f d138 c2a0 f04a 8fb9 7b63  ....'..8...J..{c
        0x0020:  a012 6d38 1435 0000 0204 0582 0402 080a  ..m8.5..........
        0x0030:  0435 688e 0435 688e 0103 0307            .5h..5h.....
17:45:24.020165 IP 10.0.0.4.53560 > 10.0.0.3.9999: Flags [.], ack 1, win 221, options [nop,nop,TS val 70609038 ecr 70609038], length 0
        0x0000:  4500 0034 13ed 4000 4006 12d1 0a00 0004  E..4..@.@.......
        0x0010:  0a00 0003 d138 270f 8fb9 7b63 c2a0 f04b  .....8'...{c...K
        0x0020:  8010 00dd 142d 0000 0101 080a 0435 688e  .....-.......5h.
        0x0030:  0435 688e                                .5h.
17:45:24.020201 IP 10.0.0.4.53560 > 10.0.0.3.9999: Flags [P.], seq 1:53, ack 1, win 221, options [nop,nop,TS val 70609038 ecr 70609038], length 52
        0x0000:  4500 0068 13ee 4000 4006 129c 0a00 0004  E..h..@.@.......
        0x0010:  0a00 0003 d138 270f 8fb9 7b63 c2a0 f04b  .....8'...{c...K
        0x0020:  8018 00dd 1461 0000 0101 080a 0435 688e  .....a.......5h.
        0x0030:  0435 688e 7b22 7822 3a22 6865 6c6c 6f22  .5h.{"x":"hello"
        0x0040:  2c22 7469 6d65 223a 2232 3031 362d 3132  ,"time":"2016-12
        0x0050:  2d32 3254 3038 3a34 353a 3233 2e39 3136  -22T08:45:23.916
        0x0060:  3431 3834 345a 227d                      41844Z"}
17:45:24.020208 IP 10.0.0.3.9999 > 10.0.0.4.53560: Flags [.], ack 53, win 219, options [nop,nop,TS val 70609038 ecr 70609038], length 0
        0x0000:  4500 0034 98c5 4000 4006 8df8 0a00 0003  E..4..@.@.......
        0x0010:  0a00 0004 270f d138 c2a0 f04b 8fb9 7b97  ....'..8...K..{.
        0x0020:  8010 00db 142d 0000 0101 080a 0435 688e  .....-.......5h.
        0x0030:  0435 688e                                .5h.
17:45:24.020219 IP 10.0.0.4.53560 > 10.0.0.3.9999: Flags [F.], seq 53, ack 1, win 221, options [nop,nop,TS val 70609038 ecr 70609038], length 0
        0x0000:  4500 0034 13ef 4000 4006 12cf 0a00 0004  E..4..@.@.......
        0x0010:  0a00 0003 d138 270f 8fb9 7b97 c2a0 f04b  .....8'...{....K
        0x0020:  8011 00dd 142d 0000 0101 080a 0435 688e  .....-.......5h.
        0x0030:  0435 688e                                .5h.
17:45:24.060374 IP 10.0.0.3.9999 > 10.0.0.4.53560: Flags [.], ack 54, win 219, options [nop,nop,TS val 70609049 ecr 70609038], length 0
        0x0000:  4500 0034 98c6 4000 4006 8df7 0a00 0003  E..4..@.@.......
        0x0010:  0a00 0004 270f d138 c2a0 f04b 8fb9 7b98  ....'..8...K..{.
        0x0020:  8010 00db 142d 0000 0101 080a 0435 6899  .....-.......5h.
        0x0030:  0435 688e                                .5h.
17:45:29.020586 IP 10.0.0.3.9999 > 10.0.0.4.53560: Flags [P.], seq 1:54, ack 54, win 219, options [nop,nop,TS val 70610289 ecr 70609038], length 53
        0x0000:  4500 0069 98c7 4000 4006 8dc1 0a00 0003  E..i..@.@.......
        0x0010:  0a00 0004 270f d138 c2a0 f04b 8fb9 7b98  ....'..8...K..{.
        0x0020:  8018 00db 1462 0000 0101 080a 0435 6d71  .....b.......5mq
        0x0030:  0435 688e 7b22 7822 3a22 6865 6c6c 6f22  .5h.{"x":"hello"
        0x0040:  2c22 7469 6d65 223a 2232 3031 362d 3132  ,"time":"2016-12
        0x0050:  2d32 3254 3038 3a34 353a 3239 2e30 3230  -22T08:45:29.020
        0x0060:  3435 3639 3138 5a22 7d                   456918Z"}
17:45:29.020626 IP 10.0.0.4.53560 > 10.0.0.3.9999: Flags [.], ack 54, win 221, options [nop,nop,TS val 70610289 ecr 70610289], length 0
        0x0000:  4500 0034 13f0 4000 4006 12ce 0a00 0004  E..4..@.@.......
        0x0010:  0a00 0003 d138 270f 8fb9 7b98 c2a0 f080  .....8'...{.....
        0x0020:  8010 00dd 142d 0000 0101 080a 0435 6d71  .....-.......5mq
        0x0030:  0435 6d71                                .5mq
17:45:29.020646 IP 10.0.0.3.9999 > 10.0.0.4.53560: Flags [F.], seq 54, ack 54, win 219, options [nop,nop,TS val 70610289 ecr 70610289], length 0
        0x0000:  4500 0034 98c8 4000 4006 8df5 0a00 0003  E..4..@.@.......
        0x0010:  0a00 0004 270f d138 c2a0 f080 8fb9 7b98  ....'..8......{.
        0x0020:  8011 00db 142d 0000 0101 080a 0435 6d71  .....-.......5mq
        0x0030:  0435 6d71                                .5mq
17:45:29.020653 IP 10.0.0.4.53560 > 10.0.0.3.9999: Flags [.], ack 55, win 221, options [nop,nop,TS val 70610289 ecr 70610289], length 0
        0x0000:  4500 0034 13f1 4000 4006 12cd 0a00 0004  E..4..@.@.......
        0x0010:  0a00 0003 d138 270f 8fb9 7b98 c2a0 f081  .....8'...{.....
        0x0020:  8010 00dd 142d 0000 0101 080a 0435 6d71  .....-.......5mq
        0x0030:  0435 6d71                                .5mq
17:45:29.080362 ARP, Request who-has 10.0.0.3 tell 10.0.0.4, length 28
        0x0000:  0001 0800 0604 0001 0242 0a00 0004 0a00  .........B......
        0x0010:  0004 0000 0000 0000 0a00 0003            ............
17:45:29.080402 ARP, Reply 10.0.0.3 is-at 02:42:0a:00:00:03 (oui Unknown), length 28
        0x0000:  0001 0800 0604 0002 0242 0a00 0003 0a00  .........B......
        0x0010:  0003 0242 0a00 0004 0a00 0004            ...B........
^C
```

65s (hangs)
```
$ ip netns exec 1-wj6r3g3dfs tcpdump -l -X -s 0
tcpdump: verbose output suppressed, use -v or -vv for full protocol decode
listening on br0, link-type EN10MB (Ethernet), capture size 262144 bytes
17:46:01.735071 IP 10.0.0.4.54622 > 10.0.0.3.9999: Flags [S], seq 3235590214, win 28200, options [mss 1410,sackOK,TS val 70618467 ecr 0,nop,wscale 7], length 0
        0x0000:  4500 003c bd25 4000 4006 6990 0a00 0004  E..<.%@.@.i.....
        0x0010:  0a00 0003 d55e 270f c0db 3046 0000 0000  .....^'...0F....
        0x0020:  a002 6e28 1435 0000 0204 0582 0402 080a  ..n(.5..........
        0x0030:  0435 8d63 0000 0000 0103 0307            .5.c........
17:46:01.735108 IP 10.0.0.3.9999 > 10.0.0.4.54622: Flags [S.], seq 3133355425, ack 3235590215, win 27960, options [mss 1410,sackOK,TS val 70618467 ecr 70618467,nop,wscale 7], length 0
        0x0000:  4500 003c 0000 4000 4006 26b6 0a00 0003  E..<..@.@.&.....
        0x0010:  0a00 0004 270f d55e bac3 35a1 c0db 3047  ....'..^..5...0G
        0x0020:  a012 6d38 1435 0000 0204 0582 0402 080a  ..m8.5..........
        0x0030:  0435 8d63 0435 8d63 0103 0307            .5.c.5.c....
17:46:01.735127 IP 10.0.0.4.54622 > 10.0.0.3.9999: Flags [.], ack 1, win 221, options [nop,nop,TS val 70618467 ecr 70618467], length 0
        0x0000:  4500 0034 bd26 4000 4006 6997 0a00 0004  E..4.&@.@.i.....
        0x0010:  0a00 0003 d55e 270f c0db 3047 bac3 35a2  .....^'...0G..5.
        0x0020:  8010 00dd 142d 0000 0101 080a 0435 8d63  .....-.......5.c
        0x0030:  0435 8d63                                .5.c
17:46:01.735179 IP 10.0.0.4.54622 > 10.0.0.3.9999: Flags [P.], seq 1:53, ack 1, win 221, options [nop,nop,TS val 70618467 ecr 70618467], length 52
        0x0000:  4500 0068 bd27 4000 4006 6962 0a00 0004  E..h.'@.@.ib....
        0x0010:  0a00 0003 d55e 270f c0db 3047 bac3 35a2  .....^'...0G..5.
        0x0020:  8018 00dd 1461 0000 0101 080a 0435 8d63  .....a.......5.c
        0x0030:  0435 8d63 7b22 7822 3a22 6865 6c6c 6f22  .5.c{"x":"hello"
        0x0040:  2c22 7469 6d65 223a 2232 3031 362d 3132  ,"time":"2016-12
        0x0050:  2d32 3254 3038 3a34 363a 3031 2e36 3339  -22T08:46:01.639
        0x0060:  3030 3731 385a 227d                      00718Z"}
17:46:01.735189 IP 10.0.0.3.9999 > 10.0.0.4.54622: Flags [.], ack 53, win 219, options [nop,nop,TS val 70618467 ecr 70618467], length 0
        0x0000:  4500 0034 b8c1 4000 4006 6dfc 0a00 0003  E..4..@.@.m.....
        0x0010:  0a00 0004 270f d55e bac3 35a2 c0db 307b  ....'..^..5...0{
        0x0020:  8010 00db 142d 0000 0101 080a 0435 8d63  .....-.......5.c
        0x0030:  0435 8d63                                .5.c
17:46:01.735205 IP 10.0.0.4.54622 > 10.0.0.3.9999: Flags [F.], seq 53, ack 1, win 221, options [nop,nop,TS val 70618467 ecr 70618467], length 0
        0x0000:  4500 0034 bd28 4000 4006 6995 0a00 0004  E..4.(@.@.i.....
        0x0010:  0a00 0003 d55e 270f c0db 307b bac3 35a2  .....^'...0{..5.
        0x0020:  8011 00dd 142d 0000 0101 080a 0435 8d63  .....-.......5.c
        0x0030:  0435 8d63                                .5.c
17:46:01.776371 IP 10.0.0.3.9999 > 10.0.0.4.54622: Flags [.], ack 54, win 219, options [nop,nop,TS val 70618478 ecr 70618467], length 0
        0x0000:  4500 0034 b8c2 4000 4006 6dfb 0a00 0003  E..4..@.@.m.....
        0x0010:  0a00 0004 270f d55e bac3 35a2 c0db 307c  ....'..^..5...0|
        0x0020:  8010 00db 142d 0000 0101 080a 0435 8d6e  .....-.......5.n
        0x0030:  0435 8d63                                .5.c
17:46:06.968378 ARP, Request who-has 10.0.0.4 tell 10.0.0.3, length 28
        0x0000:  0001 0800 0604 0001 0242 0a00 0003 0a00  .........B......
        0x0010:  0003 0000 0000 0000 0a00 0004            ............
17:46:06.968462 ARP, Reply 10.0.0.4 is-at 02:42:0a:00:00:04 (oui Unknown), length 28
        0x0000:  0001 0800 0604 0002 0242 0a00 0004 0a00  .........B......
        0x0010:  0004 0242 0a00 0003 0a00 0003            ...B........
17:47:06.735672 IP 10.0.0.3.9999 > 10.0.0.4.54622: Flags [P.], seq 1:54, ack 54, win 219, options [nop,nop,TS val 70634717 ecr 70618467], length 53
        0x0000:  4500 0069 b8c3 4000 4006 6dc5 0a00 0003  E..i..@.@.m.....
        0x0010:  0a00 0004 270f d55e bac3 35a2 c0db 307c  ....'..^..5...0|
        0x0020:  8018 00db 1462 0000 0101 080a 0435 ccdd  .....b.......5..
        0x0030:  0435 8d63 7b22 7822 3a22 6865 6c6c 6f22  .5.c{"x":"hello"
        0x0040:  2c22 7469 6d65 223a 2232 3031 362d 3132  ,"time":"2016-12
        0x0050:  2d32 3254 3038 3a34 373a 3036 2e37 3335  -22T08:47:06.735
        0x0060:  3437 3234 3334 5a22 7d                   472434Z"}
17:47:06.735717 IP 10.0.0.4.54622 > 10.0.0.3.9999: Flags [R], seq 3235590268, win 0, length 0
        0x0000:  4500 0028 4f25 4000 4006 d7a4 0a00 0004  E..(O%@.@.......
        0x0010:  0a00 0003 d55e 270f c0db 307c 0000 0000  .....^'...0|....
        0x0020:  5004 0000 ae14 0000                      P.......
17:47:11.736366 ARP, Request who-has 10.0.0.3 tell 10.0.0.4, length 28
        0x0000:  0001 0800 0604 0001 0242 0a00 0004 0a00  .........B......
        0x0010:  0004 0000 0000 0000 0a00 0003            ............
17:47:11.736386 ARP, Request who-has 10.0.0.4 tell 10.0.0.3, length 28
        0x0000:  0001 0800 0604 0001 0242 0a00 0003 0a00  .........B......
        0x0010:  0003 0000 0000 0000 0a00 0004            ............
17:47:11.736424 ARP, Reply 10.0.0.3 is-at 02:42:0a:00:00:03 (oui Unknown), length 28
        0x0000:  0001 0800 0604 0002 0242 0a00 0003 0a00  .........B......
        0x0010:  0003 0242 0a00 0004 0a00 0004            ...B........
17:47:11.736426 ARP, Reply 10.0.0.4 is-at 02:42:0a:00:00:04 (oui Unknown), length 28
        0x0000:  0001 0800 0604 0002 0242 0a00 0004 0a00  .........B......
        0x0010:  0004 0242 0a00 0003 0a00 0003            ...B........
^C
```
